out,18.0,,,,Ephedra Root,,,,polyu_chinese_2020,,,,,,,,1.0,1,,,,,,medicine,,,,,,,,,,,,,,,,,,,,,,,,,,,,,,,,,,,,,,,,,,,麻黃根,máhuánggēn,,,,,,,,,,,,,,Ephedrae Radix et Rhizoma,1.0,polyu-tcm,,麻黃根,máhuánggēn,Ephedra Root,Dried root and rhizome of Ephedra sinica Stapf or Ephedra intermedia Schrenk et C.A.Mey. (Fam. Ephedraceae),Astringent medicinal,sweet; neutral,"Heart, Lung",,,,,,,,,,,,,,,
out,18.0,,,,Epimedium Herb,,,,polyu_chinese_2020,,,,,,,,1.0,1,,,,,,medicine,,,,,,,,,,,,,,,,,,,,,,,,,,,,,,,,,,,,,,,,,,,淫羊藿,yínyánghuò,,,,,,,,,,,,,,Epimedii Herba,1.0,polyu-tcm,,淫羊藿,yínyánghuò,Epimedium Herb,"Dried aerial part of Epimedium brevicornum Maxim., Epimedium sagittatum (Sieb. et Zucc.) Maxim., Epimedium pubescens Maxim., Epimedium wushanense T.S. Ying or Epimedium koreanum Nakai (Fam. Berberidaceae)",Yang-tonifying medicinal,"pungent, sweet; warm","Liver, Kidney",,,,,,,,,,,,,,,
out,18.0,,,,Eucommia Bark,,,,polyu_chinese_2020,,,,,,,,1.0,1,,,,,,medicine,,,,,,,,,,,,,,,,,,,,,,,,,,,,,,,,,,,,,,,,,,,杜仲,dùzhòng,,,,,,,,,,,,,,Eucommiae Cortex,1.0,polyu-tcm,,杜仲,dùzhòng,Eucommia Bark,Dried stem bark of Eucommia ulmoides Oliv. (Fam. Eucommiaceae),Yang-tonifying medicinal,sweet; warm,"Liver, Kidney",,,,,,,,,,,,,,,
out,18.0,,,,European Verbena Herb,,,,polyu_chinese_2020,,,,,,,,1.0,1,,,,,,medicine,,,,,,,,,,,,,,,,,,,,,,,,,,,,,,,,,,,,,,,,,,,馬鞭草,mǎbiāncǎo,,,,,,,,,,,,,,Verbenae Herba,1.0,polyu-tcm,,馬鞭草,mǎbiāncǎo,European Verbena Herb,Dried aerial part of Verbena officinalis L. (Fam. Verbenaceae),Blood-activating trauma-curing medicinal,bitter; cool,"Liver, Spleen",,,,,,,,,,,,,,,
out,18.0,,,,Exsiccated Sodium Sulfate,,,,polyu_chinese_2020,,,,,,,,1.0,1,,,,,,medicine,,,,,,,,,,,,,,,,,,,,,,,,,,,,,,,,,,,,,,,,,,,玄明粉,xuánmíngfěn,,,,,,,,,,,,,,Natrii Sufas Exsiccatus,1.0,polyu-tcm,,玄明粉,xuánmíngfěn,Exsiccated Sodium Sulfate,"Obtained from Glauber's salts by efflorescencing, containing mainly sodium sulfate (Na2SO4)",Heat-clearing and detoxicating medicinal,"salty, bitter; cold","Stomach, Large intestine",,,,,,,,,,,,,,,
out,18.0,,,,Feather Cockscomb Seed,,,,polyu_chinese_2020,,,,,,,,1.0,1,,,,,,medicine,,,,,,,,,,,,,,,,,,,,,,,,,,,,,,,,,,,,,,,,,,,青葙子,qīngxiāngzǐ,,,,,,,,,,,,,,Celosiae Semen,1.0,polyu-tcm,,青葙子,qīngxiāngzǐ,Feather Cockscomb Seed,Dried ripe seed of Celosia argentea L. (Fam. Amaranthaceae),Heat-clearing and fire-purging medicinal,bitter; slightly cold,Liver,,,,,,,,,,,,,,,
out,18.0,,,,Fermented Soybean,,,,polyu_chinese_2020,,,,,,,,1.0,1,,,,,,medicine,,,,,,,,,,,,,,,,,,,,,,,,,,,,,,,,,,,,,,,,,,,淡豆豉,dàndòuchǐ,,,,,,,,,,,,,,Sojae Praeparatum Semen,1.0,polyu-tcm,,淡豆豉,dàndòuchǐ,Fermented Soybean,Fermented preparation obtain from the ripe seed Glycine max (L.) Merr. (Fam. Fabaceae),Wind-heat dispersing medicinal,"pungent, bitter; cool","Lung, Stomach",,,,,,,,,,,,,,,
out,18.0,,,,Field Thistle Herb,,,,polyu_chinese_2020,,,,,,,,1.0,1,,,,,,medicine,,,,,,,,,,,,,,,,,,,,,,,,,,,,,,,,,,,,,,,,,,,小薊,xiǎojì,,,,,,,,,,,,,,Cirsii Herba,1.0,polyu-tcm,,小薊,xiǎojì,Field Thistle Herb,Dried aerial part of Cirsium setosum (Willd.) MB. (Fam. Compositae),Blood-cooling hemostatic medicinal,"sweet, bitter; cool","Heart, Liver",,,,,,,,,,,,,,,
out,18.0,,,,Figwort Root,,,,polyu_chinese_2020,,,,,,,,1.0,1,,,,,,medicine,,,,,,,,,,,,,,,,,,,,,,,,,,,,,,,,,,,,,,,,,,,玄參,xuáncān,,,,,,,,,,,,,,Scrophulariae Radix,1.0,polyu-tcm,,玄參,xuáncān,Figwort Root,Dried root of Scrophularia ningpoensis Hemsl. (Fam. Scrophulariaceae),Heat-clearing and blood-cooling medicinal,"sweet, bitter, salty; slightly cold","Lung, Kidney, Stomach",,,,,,,,,,,,,,,
out,18.0,,,,Figwortflower Picrorhiza Rhizome,,,,polyu_chinese_2020,,,,,,,,1.0,1,,,,,,medicine,,,,,,,,,,,,,,,,,,,,,,,,,,,,,,,,,,,,,,,,,,,胡黃連,húhuánglián,,,,,,,,,,,,,,Picrorhizae Rhizoma,1.0,polyu-tcm,,胡黃連,húhuánglián,Figwortflower Picrorhiza Rhizome,Dried rhizome of Picrorhiza scrophulariiflora Pennell (Fam. Scrophulariaceae),Deficiency heat-clearing medicinal,bitter; cold,"Liver, Stomach, Large intestine",,,,,,,,,,,,,,,
out,18.0,,,,Fineleaf Schizonepeta Spike,,,,polyu_chinese_2020,,,,,,,,1.0,1,,,,,,medicine,,,,,,,,,,,,,,,,,,,,,,,,,,,,,,,,,,,,,,,,,,,荊芥穗,jīngjièsùi,,,,,,,,,,,,,,Schizonepetae Spica,1.0,polyu-tcm,,荊芥穗,jīngjièsùi,Fineleaf Schizonepeta Spike,Dried fruit-spike of Schizonepeta tenuisfolia Briq. (Fam. Labiatae),Wind-cold-dispersing medicinal,pungent; slightly warm,"Liver, Lung",,,,,,,,,,,,,,,
out,18.0,,,,Finger Citron,,,,polyu_chinese_2020,,,,,,,,1.0,1,,,,,,medicine,,,,,,,,,,,,,,,,,,,,,,,,,,,,,,,,,,,,,,,,,,,佛手,fóshǒu,,,,,,,,,,,,,,Citri Sarcodactylis Fructus,1.0,polyu-tcm,,佛手,fóshǒu,Finger Citron,Dried fruit of Citrus medica L. var. sarcodactylis Swingle (Fam. Rutaceae),Qi-regulating medicinal,"pungent, bitter, sour; warm","Liver, Spleen, Lung",,,,,,,,,,,,,,,
out,18.0,,,,Flatstem Milkvetch Seed,,,,polyu_chinese_2020,,,,,,,,1.0,1,,,,,,medicine,,,,,,,,,,,,,,,,,,,,,,,,,,,,,,,,,,,,,,,,,,,沙苑子,shāyuànzǐ,,,,,,,,,,,,,,Astragali Complanati Semen,1.0,polyu-tcm,,沙苑子,shāyuànzǐ,Flatstem Milkvetch Seed,Dried ripe seed of Astragalus complanatus R.Br. (Fam. Fabaceae),Yang-tonifying medicinal,sweet; warm,"Liver, Kidney",,,,,,,,,,,,,,,
out,18.0,,,,Fluorite,,,,polyu_chinese_2020,,,,,,,,1.0,1,,,,,,medicine,,,,,,,,,,,,,,,,,,,,,,,,,,,,,,,,,,,,,,,,,,,紫石英,zǐshíyīng,,,,,,,,,,,,,,Fluoritum,1.0,polyu-tcm,,紫石英,zǐshíyīng,Fluorite,"Mineral of florides of fluoride group, containing mainly calcium fluoride (CaF2)",Settling tranquillizing medicinal,sweet; warm,"Heart, Lung, Kidney",,,,,,,,,,,,,,,
out,18.0,,,,Fortune Eupatorium Herb,,,,polyu_chinese_2020,,,,,,,,1.0,1,,,,,,medicine,,,,,,,,,,,,,,,,,,,,,,,,,,,,,,,,,,,,,,,,,,,佩蘭,pèilán,,,,,,,,,,,,,,Eupatorii Herba,1.0,polyu-tcm,,佩蘭,pèilán,Fortune Eupatorium Herb,Dried aerial part of Eupatorium fortunei Turcz. (Fam. Compositae),Dampness-resolving medicinal,pungent; neutral,"Spleen, Stomach, Lung",,,,,,,,,,,,,,,
out,18.0,,,,Fortune Windmillpalm Petiole,,,,polyu_chinese_2020,,,,,,,,1.0,1,,,,,,medicine,,,,,,,,,,,,,,,,,,,,,,,,,,,,,,,,,,,,,,,,,,,棕櫚,zōnglv́,,,,,,,,,,,,,,Trachycarpi Petiolus,1.0,polyu-tcm,,棕櫚,zōnglv́,Fortune Windmillpalm Petiole,Dried petiole of Trachycar fortunei (Hook. f.) H. Wendl. (Fam. Palmae),Astringent hemostatic medicinal,"bitter, astringent; neutral","Lung, Liver, Large intestine",,,,,,,,,,,,,,,
out,18.0,,,,Fortune's Drynaria Rhizome,,,,polyu_chinese_2020,,,,,,,,1.0,1,,,,,,medicine,,,,,,,,,,,,,,,,,,,,,,,,,,,,,,,,,,,,,,,,,,,骨碎補,gǔsùibǔ,,,,,,,,,,,,,,Drynariae Rhizoma,1.0,polyu-tcm,,骨碎補,gǔsùibǔ,Fortune's Drynaria Rhizome,Dried rhizome of Drynaria fortunei (Kunze) J.Sm. (Fam. Polypodiaceae),Blood-activating trauma-curing medicinal,bitter; warm,"Liver, Kidney",,,,,,,,,,,,,,,
out,18.0,,,,Fourleaf Ladybell Root,,,,polyu_chinese_2020,,,,,,,,1.0,1,,,,,,medicine,,,,,,,,,,,,,,,,,,,,,,,,,,,,,,,,,,,,,,,,,,,南沙參,nánshācān,,,,,,,,,,,,,,Adenophorae Radix,1.0,polyu-tcm,,南沙參,nánshācān,Fourleaf Ladybell Root,Dried root of Adenophora tetraphylla (Thunb.) Fisch. or Adenophora stricta Miq. (Fam. Campanulaceae),Yin-tonifying medicinal,sweet; slightly cold,"Lung, Stomach",,,,,,,,,,,,,,,
out,18.0,,,,Fourstamen Stephania Root,,,,polyu_chinese_2020,,,,,,,,1.0,1,,,,,,medicine,,,,,,,,,,,,,,,,,,,,,,,,,,,,,,,,,,,,,,,,,,,防己,fángjǐ,,,,,,,,,,,,,,Stephaniae Tetrandrae Radix,1.0,polyu-tcm,,防己,fángjǐ,Fourstamen Stephania Root,Dried root of Stephania tetrandra S. Moore (Fam. Menispermaceae),Wind-dampness-dispelling and heat-clearing medicinal,bitter; cold,"Bladder, Lung",,,,,,,,,,,,,,,
out,18.0,,,,Fragrant Solomonseal Rhizome,,,,polyu_chinese_2020,,,,,,,,1.0,1,,,,,,medicine,,,,,,,,,,,,,,,,,,,,,,,,,,,,,,,,,,,,,,,,,,,玉竹,yùzhú,,,,,,,,,,,,,,Polygonati Odorati Rhizoma,1.0,polyu-tcm,,玉竹,yùzhú,Fragrant Solomonseal Rhizome,Dried rhizome of Polygonatum odoratum (Mill.) Druce (Fam. Liliaceae),Yin-tonifying medicinal,sweet; slightly cold,"Lung, Stomach",,,,,,,,,,,,,,,
out,18.0,,,,Franchet Groundcherry Fruit,,,,polyu_chinese_2020,,,,,,,,1.0,1,,,,,,medicine,,,,,,,,,,,,,,,,,,,,,,,,,,,,,,,,,,,,,,,,,,,錦燈籠,jǐndēnglóng,,,,,,,,,,,,,,Physalis Calyx Seu Fructus,1.0,polyu-tcm,,錦燈籠,jǐndēnglóng,Franchet Groundcherry Fruit,Dried persistent calyx or the persistent calyx with fruit of Physalis alkekengi L. var. franchetyii (Mast.) Makino (Fam. Solanaceae),Heat-clearing and detoxicating medicinal,bitter; cold,Lung,,,,,,,,,,,,,,,
out,19.0,,,,Fresh Ginger,,,,polyu_chinese_2020,,,,,,,,1.0,1,Zingiber officinale,,,,,medicine,,,,,,,,,,,,,,,,,,,,,,,,,,,,,,,,,,,,,,,,,,,生薑,shēngjiāng,,,,,,,,,,,,,,Zingiberis Rhizoma Recens,1.0,polyu-tcm,,生薑,shēngjiāng,Fresh Ginger,Fresh rhizome of Zingiber officinale (Willd.) Rosc. (Fam. Zingiberaceae),Wind-cold-dispersing medicinal,pungent; slightly warm,"Spleen, Lung, Stomach",,,,,,,,,,,,,,,
out,18.0,,,,Gambir Plant,,,,polyu_chinese_2020,,,,,,,,1.0,1,,,,,,medicine,,,,,,,,,,,,,,,,,,,,,,,,,,,,,,,,,,,,,,,,,,,鈎藤,gōuténg,,,,,,,,,,,,,,Uncariae cum Uncis Ramulus,1.0,polyu-tcm,,鈎藤,gōuténg,Gambir Plant,"Dried hook-bearing branch of Uncaria rhynchophylla (Miq.) Jacks., Uncaria macrophylla Wall., Uncaria hirsuta Havil., Uncaria sinensis (Oliv.) Havil. or Uncaria sessilifructus Roxb. (Fam. Rubiaceae)",Liver-pacifying and wind-extinguishing medicinal,sweet; cool,"Liver, Pericardium",,,,,,,,,,,,,,,
out,18.0,,,,Garden Balsam Seed,,,,polyu_chinese_2020,,,,,,,,1.0,1,,,,,,medicine,,,,,,,,,,,,,,,,,,,,,,,,,,,,,,,,,,,,,,,,,,,急性子,jíxìngzǐ,,,,,,,,,,,,,,Impatientis Semen,1.0,polyu-tcm,,急性子,jíxìngzǐ,Garden Balsam Seed,Dried ripe seed of Impatiens balsamina L. (Fam. Balsaminaceae),Blood-breaking mass eliminating medicinal,"slightly bitter, pungent; warm; slightly toxic","Lung, Liver",,,,,,,,,,,,,,,
out,18.0,,,,Garden Burnet Root,,,,polyu_chinese_2020,,,,,,,,1.0,1,,,,,,medicine,,,,,,,,,,,,,,,,,,,,,,,,,,,,,,,,,,,,,,,,,,,地榆,dìyú,,,,,,,,,,,,,,Sanguisorbae Radix,1.0,polyu-tcm,,地榆,dìyú,Garden Burnet Root,Dried root of Sanguisorba officinalis L. or Sanguisorba officinals L. var. longifolia (Bert.) Yü et Li (Fam. Rosaceae),Blood-cooling hemostatic medicinal,"bitter, sour, astringent; slightly cold","Liver, Large intestine",,,,,,,,,,,,,,,
out,18.0,,,,Germinated Barley,,,,polyu_chinese_2020,,,,,,,,1.0,1,,,,,,medicine,,,,,,,,,,,,,,,,,,,,,,,,,,,,,,,,,,,,,,,,,,,麥芽,màiyá,,,,,,,,,,,,,,Hordei Germinatus Fructus,1.0,polyu-tcm,,麥芽,màiyá,Germinated Barley,Dried germinated ripe fruit of Hordeum vulgare L. (Fam. Gramineae),Digestant medicinal,sweet; neutral,"Spleen, Stomach",,,,,,,,,,,,,,,
out,18.0,,,,Giant Knotweed Rhizome,,,,polyu_chinese_2020,,,,,,,,1.0,1,,,,,,medicine,,,,,,,,,,,,,,,,,,,,,,,,,,,,,,,,,,,,,,,,,,,虎杖,hǔzhàng,,,,,,,,,,,,,,Polygoni Cuspidati Rhizoma et Radix,1.0,polyu-tcm,,虎杖,hǔzhàng,Giant Knotweed Rhizome,Dried rhizome and root of Polygonum cuspidatum Sieb. et Zucc. (Fam. Polygonaceae),Dampness-draining anti-icteric medicinal,slightly bitter; slightly cold,"Liver, Lung, Gallbladder",,,,,,,,,,,,,,,
out,18.0,,,,Giant Typhonium Rhizome,,,,polyu_chinese_2020,,,,,,,,1.0,1,,,,,,medicine,,,,,,,,,,,,,,,,,,,,,,,,,,,,,,,,,,,,,,,,,,,白附子,báifùzǐ,,,,,,,,,,,,,,Typhonii Rhizoma,1.0,polyu-tcm,,白附子,báifùzǐ,Giant Typhonium Rhizome,Dried tuber of Typhonium giganteum Engl. (Fam. Araceae),Phlegm resolving medicinal,pungent; warm; toxic,"Stomach, Liver",,,,,,,,,,,,,,,
out,18.0,,,,Ginkgo Leaf,,,,polyu_chinese_2020,,,,,,,,1.0,1,,,,,,medicine,,,,,,,,,,,,,,,,,,,,,,,,,,,,,,,,,,,,,,,,,,,銀杏葉,yínxìngyè,,,,,,,,,,,,,,Ginkgo Folium,1.0,polyu-tcm,,銀杏葉,yínxìngyè,Ginkgo Leaf,Dried leaf of Ginkgo biloba L. (Fam. Ginkgoaceae),Cough-suppressing and panting-calming medicinal,"sweet, bitter, astringent; neutral","Heart, Lung",,,,,,,,,,,,,,,
out,18.0,,,,Ginkgo Seed,,,,polyu_chinese_2020,,,,,,,,1.0,1,,,,,,medicine,,,,,,,,,,,,,,,,,,,,,,,,,,,,,,,,,,,,,,,,,,,白果,báiguǒ,,,,,,,,,,,,,,Ginkgo Semen,1.0,polyu-tcm,,白果,báiguǒ,Ginkgo Seed,Dried ripe seed of Ginkgo biloba L. (Fam. Ginkgoaceae),Cough-suppressing and panting-calming medicinal,"sweet, bitter, astringent; neutral; toxic",Lung,,,,,,,,,,,,,,,
out,18.0,,,,Ginseng Leaf,,,,polyu_chinese_2020,,,,,,,,1.0,1,,,,,,medicine,,,,,,,,,,,,,,,,,,,,,,,,,,,,,,,,,,,,,,,,,,,人參葉,réncānyè,,,,,,,,,,,,,,Ginseng Folium,1.0,polyu-tcm,,人參葉,réncānyè,Ginseng Leaf,Dried leaf of Panax ginseng C.A. Mey. (Fam. Araliaceae),Qi-tonifying medicinal,"bitter, sweet; cold","Lung, Stomach",,,,,,,,,,,,,,,
out,18.0,,,,Glabrous Greenbrier Rhizome,,,,polyu_chinese_2020,,,,,,,,1.0,1,,,,,,medicine,,,,,,,,,,,,,,,,,,,,,,,,,,,,,,,,,,,,,,,,,,,土茯苓,tǔfúlíng,,,,,,,,,,,,,,Smilacis Glabrae Rhizoma,1.0,polyu-tcm,,土茯苓,tǔfúlíng,Glabrous Greenbrier Rhizome,Dried rhizome of Smilax glabra Roxb. (Fam. Liliaceae),Heat-clearing and detoxicating medicinal,"sweet, bland; neutral","Liver, Stomach",,,,,,,,,,,,,,,
out,18.0,,,,Glabrous Sarcandra Herb,,,,polyu_chinese_2020,,,,,,,,1.0,1,,,,,,medicine,,,,,,,,,,,,,,,,,,,,,,,,,,,,,,,,,,,,,,,,,,,腫節風,zhǒngjiéfēng,,,,,,,,,,,,,,Sarcandrae Herba,1.0,polyu-tcm,,腫節風,zhǒngjiéfēng,Glabrous Sarcandra Herb,Dried herb of Sarcandra glabra (Thunb.) Nakai (Fam. Chloranthaceae),Heat-clearing and blood-cooling medicinal,"bitter, pungent; neutral","Heart, Liver",,,,,,,,,,,,,,,
out,18.0,,,,Glossy Ganoderma,,,,polyu_chinese_2020,,,,,,,,1.0,1,,,,,,medicine,,,,,,,,,,,,,,,,,,,,,,,,,,,,,,,,,,,,,,,,,,,靈芝,língzhī,,,,,,,,,,,,,,Ganoderma,1.0,polyu-tcm,,靈芝,língzhī,Glossy Ganoderma,"Dried sporophore of Ganoderma lucidum (Leyss. ex Fr.) Karst. or Ganoderma sinense Zhao, Xu et Zhang (Fam. Polyporaceae)",Qi-tonifying medicinal,sweet;,"Liver, Heart, Lung, Kidney",,,,,,,,,,,,,,,
out,18.0,,,,Glossy Privet Fruit,,,,polyu_chinese_2020,,,,,,,,1.0,1,,,,,,medicine,,,,,,,,,,,,,,,,,,,,,,,,,,,,,,,,,,,,,,,,,,,女貞子,nv̌zhēnzǐ,,,,,,,,,,,,,,Ligustri Lucidi Fructus,1.0,polyu-tcm,,女貞子,nv̌zhēnzǐ,Glossy Privet Fruit,Dried fruit of Ligustrum lucidum Ait. (Fam. Oleaceae),Yin-tonifying medicinal,"sweet, bitter; cool","Liver, Kidney",,,,,,,,,,,,,,,
out,18.0,,,,Glue of tortoise shell,,,,polyu_chinese_2020,,,,,,,,1.0,1,,,,,,medicine,,,,,,,,,,,,,,,,,,,,,,,,,,,,,,,,,,,,,,,,,,,龜甲膠,gūijiǎjiāo,,,,,,,,,,,,,,Carapax et Plastrum Testudinis Colla,1.0,polyu-tcm,,龜甲膠,gūijiǎjiāo,Glue of tortoise shell,Solid glue prepared from Carapace and plastron of Chinemys reevesii (Gray) (Fam. Emydidae),Yin-tonifying medicinal,"salty, sweet; cool","Liver, Kidney, Heart",,,,,,,,,,,,,,,
out,18.0,,,,Golden thread,,,,polyu_chinese_2020,,,,,,,,1.0,1,,,,,,medicine,,,,,,,,,,,,,,,,,,,,,,,,,,,,,,,,,,,,,,,,,,,黃連,huánglián,,,,,,,,,,,,,,Coptidis Rhizoma,1.0,polyu-tcm,,黃連,huánglián,Golden thread,"Dried rhizome of Coptis chinensis Franch., Coptis deltoidea C.Y. Cheng et Hsiao or Coptis teeta Wall. (Fam. Ranunculaceae)",Heat-clearing and dampness-drying medicinal,bitter; cold,"Liver, Heart, Spleen, Gallbladder, Stomach, Large intestine",,,,,,,,,,,,,,,
out,18.0,,,,Gordon Euryale Seed,,,,polyu_chinese_2020,,,,,,,,1.0,1,,,,,,medicine,,,,,,,,,,,,,,,,,,,,,,,,,,,,,,,,,,,,,,,,,,,芡實,qiànshí,,,,,,,,,,,,,,Euryales Semen,1.0,polyu-tcm,,芡實,qiànshí,Gordon Euryale Seed,Dried kernel of ripe seed of Euryale ferox Salisb. (Fam. Nymphaeaceae),Astringent medicinal,"sweet, astringent; neutral","Spleen, Kidney",,,,,,,,,,,,,,,
out,18.0,,,,Grassleaf Sweetflag Rhizome,,,,polyu_chinese_2020,,,,,,,,1.0,1,,,,,,medicine,,,,,,,,,,,,,,,,,,,,,,,,,,,,,,,,,,,,,,,,,,,石菖蒲,shíchāngpú,,,,,,,,,,,,,,Acori Tatarinowii Rhizoma,1.0,polyu-tcm,,石菖蒲,shíchāngpú,Grassleaf Sweetflag Rhizome,Dried rhizome of Acorus tatarinowii Schott (Fam. Araceae),Orifice-opening medicinal,"pungent, bitter; warm","Heart, Stomach",,,,,,,,,,,,,,,
out,18.0,,,,Great Burdock Achene,,,,polyu_chinese_2020,,,,,,,,1.0,1,,,,,,medicine,,,,,,,,,,,,,,,,,,,,,,,,,,,,,,,,,,,,,,,,,,,牛蒡子,níubàngzǐ,,,,,,,,,,,,,,Arctii Fructus,1.0,polyu-tcm,,牛蒡子,níubàngzǐ,Great Burdock Achene,Dried ripe fruit of Arctium lappa L. (Fam. Compositae),Wind-heat dispersing medicinal,"pungent, bitter; cold","Lung, Stomach",,,,,,,,,,,,,,,
out,18.0,,,,Green Tangerine Peel,,,,polyu_chinese_2020,,,,,,,,1.0,1,,,,,,medicine,,,,,,,,,,,,,,,,,,,,,,,,,,,,,,,,,,,,,,,,,,,青皮,qīngpí,,,,,,,,,,,,,,Citri Reticulatae Viride Pericarpium,1.0,polyu-tcm,,青皮,qīngpí,Green Tangerine Peel,Dried pericarp of the young or immature fruits of Citrus reticulata Blanco or its cultivars (Fam. Rutaceae),Qi-regulating medicinal,"pungent, bitter; warm","Liver, Gallbladder, Stomach",,,,,,,,,,,,,,,
out,18.0,,,,Grosvenor Momordica Fruit,,,,polyu_chinese_2020,,,,,,,,1.0,1,,,,,,medicine,,,,,,,,,,,,,,,,,,,,,,,,,,,,,,,,,,,,,,,,,,,羅漢果,luóhànguǒ,,,,,,,,,,,,,,Momordicae Fructus,1.0,polyu-tcm,,羅漢果,luóhànguǒ,Grosvenor Momordica Fruit,Dried fruit of Momordica grosvenori Swingle (Fam. Cucurbitaceae),Cough-suppressing and panting-calming medicinal,sweet; cool,"Lung, Large intestine",,,,,,,,,,,,,,,
out,18.0,,,,Ground Beetle,,,,polyu_chinese_2020,,,,,,,,1.0,1,,,,,,medicine,,,,,,,,,,,,,,,,,,,,,,,,,,,,,,,,,,,,,,,,,,,土鱉蟲,tǔbiēchóng,,,,,,,,,,,,,,Eupolyphaga Seu Steleophaga,1.0,polyu-tcm,,土鱉蟲,tǔbiēchóng,Ground Beetle,"Dried body of female, Eupolyphaga sinensis Walker or Steleophaga plancyi (Boleny) (Fam. Corydiidae)",Blood-activating trauma-curing medicinal,salty; cold; slightly toxic,Liver,,,,,,,,,,,,,,,
out,18.0,,,,Gypsum,,,,polyu_chinese_2020,,,,,,,,1.0,1,,,,,,medicine,,,,,,,,,,,,,,,,,,,,,,,,,,,,,,,,,,,,,,,,,,,石膏,shígāo,,,,,,,,,,,,,,Fibrosum Gypsum,1.0,polyu-tcm,,石膏,shígāo,Gypsum,"Plaster Mineral of sulfates of plaster Mineral group, containing mainly hydrate calcium sulfate (CaSO4‧2H2O)",Heat-clearing and fire-purging medicinal,"sweet, pungent; strongly cold","Lung, Stomach",,,,,,,,,,,,,,,
out,18.0,,,,Hairyvein Agrimonia Herb,,,,polyu_chinese_2020,,,,,,,,1.0,1,,,,,,medicine,,,,,,,,,,,,,,,,,,,,,,,,,,,,,,,,,,,,,,,,,,,仙鶴草,xiānhècǎo,,,,,,,,,,,,,,Agrimoniae Herba,1.0,polyu-tcm,,仙鶴草,xiānhècǎo,Hairyvein Agrimonia Herb,Dried aerial part of Agrimonia pilosa Ledeb. (Fam. Rosaceae),Astringent hemostatic medicinal,"bitter, astringent; neutral","Heart, Liver",,,,,,,,,,,,,,,
out,18.0,,,,Hawthorn Fruit,,,,polyu_chinese_2020,,,,,,,,1.0,1,,,,,,medicine,,,,,,,,,,,,,,,,,,,,,,,,,,,,,,,,,,,,,,,,,,,山楂,shānzhā,,,,,,,,,,,,,,Crataegi Fructus,1.0,polyu-tcm,,山楂,shānzhā,Hawthorn Fruit,Dried ripe fruit of Crataegus pinnatifida Bge. var. major N. E. Br. or Crataegus pinnatifida Bge. (Fam. Rosaceae),Digestant medicinal,"sweet, sour; slightly warm","Liver, Spleen, Stomach",,,,,,,,,,,,,,,
out,18.0,,,,Heartleaf Houttuynia Herb,,,,polyu_chinese_2020,,,,,,,,1.0,1,,,,,,medicine,,,,,,,,,,,,,,,,,,,,,,,,,,,,,,,,,,,,,,,,,,,魚腥草,yúxīngcǎo,,,,,,,,,,,,,,Houttuyniae Herba,1.0,polyu-tcm,,魚腥草,yúxīngcǎo,Heartleaf Houttuynia Herb,Fresh or dried aerial part of Houttuynia cordata Thumb. (Fam. Saururaceae),Heat-clearing and detoxicating medicinal,pungent; slightly cold,Lung,,,,,,,,,,,,,,,
out,18.0,,,,Hematite,,,,polyu_chinese_2020,,,,,,,,1.0,1,,,,,,medicine,,,,,,,,,,,,,,,,,,,,,,,,,,,,,,,,,,,,,,,,,,,赭石,zhěshí,,,,,,,,,,,,,,Haematitum,1.0,polyu-tcm,,赭石,zhěshí,Hematite,"Mineral of oxides of corundum group, containing mainly ferric oxide (Fe2O3)",Liver-pacifying and wind-extinguishing medicinal,bitter; cold,"Liver, Heart",,,,,,,,,,,,,,,
out,18.0,,,,Hemp seed,,,,polyu_chinese_2020,,,,,,,,1.0,1,,,,,,medicine,,,,,,,,,,,,,,,,,,,,,,,,,,,,,,,,,,,,,,,,,,,火麻仁,huǒmárén,,,,,,,,,,,,,,Cannabis Fructus,1.0,polyu-tcm,,火麻仁,huǒmárén,Hemp seed,Dried ripe fruit of Cannabis sativa L. (Fam. Moraceae),Laxative medicinal,sweet; neutral,"Spleen, Stomach, Large intestine",,,,,,,,,,,,,,,
out,18.0,,,,Heterophylly Falsestarwort Root,,,,polyu_chinese_2020,,,,,,,,1.0,1,,,,,,medicine,,,,,,,,,,,,,,,,,,,,,,,,,,,,,,,,,,,,,,,,,,,太子參,tàizǐcān,,,,,,,,,,,,,,Pseudostellariae Radix,1.0,polyu-tcm,,太子參,tàizǐcān,Heterophylly Falsestarwort Root,Dried root tuber of Pseudostellaria heterophylla (Miq.) Pax ex Pax et Hoffm. (Fam. Caryophyllaceae),Qi-tonifying medicinal,"sweet, slightly bitter; neutral","Spleen, Lung",,,,,,,,,,,,,,,
out,18.0,,,,Himalayan Teasel Root,,,,polyu_chinese_2020,,,,,,,,1.0,1,,,,,,medicine,,,,,,,,,,,,,,,,,,,,,,,,,,,,,,,,,,,,,,,,,,,續斷,xùduàn,,,,,,,,,,,,,,Dipsaci Radix,1.0,polyu-tcm,,續斷,xùduàn,Himalayan Teasel Root,Dried root of Dispsacus asperoides C.Y. Cheng et T. M. Ai (Fam. Dispsacaceae),Yang-tonifying medicinal,"pungent, bitter; slightly warm","Liver, Kidney",,,,,,,,,,,,,,,
out,18.0,,,,Hirsute Shiny Bugleweed Herb,,,,polyu_chinese_2020,,,,,,,,1.0,1,,,,,,medicine,,,,,,,,,,,,,,,,,,,,,,,,,,,,,,,,,,,,,,,,,,,澤蘭,zélán,,,,,,,,,,,,,,Lycopi Herba,1.0,polyu-tcm,,澤蘭,zélán,Hirsute Shiny Bugleweed Herb,Dried aerial part of Lyscopus lucidus Turcz. var. hirtus Regel (Fam. Labiatae),Blood-activating menstruation regulating medicinal,"bitter, pungent; slightly warm","Liver, Spleen",,,,,,,,,,,,,,,
out,18.0,,,,Hogfennel Root,,,,polyu_chinese_2020,,,,,,,,1.0,1,,,,,,medicine,,,,,,,,,,,,,,,,,,,,,,,,,,,,,,,,,,,,,,,,,,,前胡,qiánhú,,,,,,,,,,,,,,Peucedani Radix,1.0,polyu-tcm,,前胡,qiánhú,Hogfennel Root,Dried root of Peucedanum praeruptorum Dunn (Fam. Apiaceae),Phlegm resolving medicinal,"pungent, bitter; slightly cold",Lung,,,,,,,,,,,,,,,
out,18.0,,,,Honey,,,,polyu_chinese_2020,,,,,,,,1.0,1,,,,,,medicine,,,,,,,,,,,,,,,,,,,,,,,,,,,,,,,,,,,,,,,,,,,蜂蜜,fēngmì,,,,,,,,,,,,,,Mel,1.0,polyu-tcm,,蜂蜜,fēngmì,Honey,Saccharine fluid deposited by Apis cerana Fabricius or Apis mellifera Linnaeus (Fam. Apidae),Qi-tonifying medicinal,sweet; neutral,"Lung, Stomach, Large intestine",,,,,,,,,,,,,,,
out,18.0,,,,Honeycomb,,,,polyu_chinese_2020,,,,,,,,1.0,1,,,,,,medicine,,,,,,,,,,,,,,,,,,,,,,,,,,,,,,,,,,,,,,,,,,,蜂房,fēngfáng,,,,,,,,,,,,,,Vespae Nidus,1.0,polyu-tcm,,蜂房,fēngfáng,Honeycomb,"Honeycomb of Polistes olivaceous (DeGeer), Polistes japonicus Saussure or Parapolybia varia Fabricius (Fam. Vespidae)",Dry dampness relieve itching and kill worms medicinal,sweet; neutral,Stomach,,,,,,,,,,,,,,,
out,18.0,,,,Honeysuckle Stem,,,,polyu_chinese_2020,,,,,,,,1.0,1,,,,,,medicine,,,,,,,,,,,,,,,,,,,,,,,,,,,,,,,,,,,,,,,,,,,忍冬藤,rěndōngténg,,,,,,,,,,,,,,Lonicerae Japonicae Caulis,1.0,polyu-tcm,,忍冬藤,rěndōngténg,Honeysuckle Stem,Dried stem and branch of Lonicera japonica Thunb (Fam. Caprifoliaceae),Heat-clearing and detoxicating medicinal,sweet; cold,"Lung, Stomach",,,,,,,,,,,,,,,
out,18.0,,,,Human Placenta,,,,polyu_chinese_2020,,,,,,,,1.0,1,,,,,,medicine,,,,,,,,,,,,,,,,,,,,,,,,,,,,,,,,,,,,,,,,,,,紫河車,zǐhéchē,,,,,,,,,,,,,,Hominis Placenta,1.0,polyu-tcm,,紫河車,zǐhéchē,Human Placenta,Dried placenta of a healthy women,Yang-tonifying medicinal,"sweet, salty; warm","Heart, Lung, Kidney",,,,,,,,,,,,,,,
out,18.0,,,,Hypoglaucous Collett Yam Rhizome,,,,polyu_chinese_2020,,,,,,,,1.0,1,,,,,,medicine,,,,,,,,,,,,,,,,,,,,,,,,,,,,,,,,,,,,,,,,,,,粉萆薢,fěnpìjiē,,,,,,,,,,,,,,Dioscoreae Hypolaucae Rhizoma,1.0,polyu-tcm,,粉萆薢,fěnpìjiē,Hypoglaucous Collett Yam Rhizome,Dried rhizome of Dioscorea hypoglauca Plakibin (Fam. Dioscoreaceae),Strangury-relieving diuretic medicinal,bitter; neutral,"Kidney, Stomach",,,,,,,,,,,,,,,
out,18.0,,,,Immature Orange Fruit,,,,polyu_chinese_2020,,,,,,,,1.0,1,,,,,,medicine,,,,,,,,,,,,,,,,,,,,,,,,,,,,,,,,,,,,,,,,,,,枳實,zhīshí,,,,,,,,,,,,,,Aurantii Immaturus Fructus,1.0,polyu-tcm,,枳實,zhīshí,Immature Orange Fruit,Dried young fruit of Citrus aurantium L. and its cultivated varieties (Fam. Rutaceae),Qi-regulating medicinal,"pungent, bitter, sour; warm","Spleen, Stomach",,,,,,,,,,,,,,,
out,18.0,,,,Incised Notopterygium Rhizome or Root,,,,polyu_chinese_2020,,,,,,,,1.0,1,,,,,,medicine,,,,,,,,,,,,,,,,,,,,,,,,,,,,,,,,,,,,,,,,,,,羌活,qiānghuó,,,,,,,,,,,,,,Notopterygii Rhizoma et Radix,1.0,polyu-tcm,,羌活,qiānghuó,Incised Notopterygium Rhizome or Root,Dried rhizome and root of Notopterygium incisum Ting ex H.T. Chang or Notopterygium forbesii Boiss (Fam. Apiaceae),Wind-cold-dispersing medicinal,"pungent, bitter; warm","Bladder, Kidney",,,,,,,,,,,,,,,
out,18.0,,,,Indian Bread,,,,polyu_chinese_2020,,,,,,,,1.0,1,,,,,,medicine,,,,,,,,,,,,,,,,,,,,,,,,,,,,,,,,,,,,,,,,,,,茯苓,fúlíng,,,,,,,,,,,,,,Poria,1.0,polyu-tcm,,茯苓,fúlíng,Indian Bread,"Dried sclerotium of the fungus, Poria cocos (Schw.) Wolf (Fam. Polyporaceae)",Dampness-draining diuretic medicinal,"sweet, bland; neutral","Heart, Spleen, Lung, Kidney",,,,,,,,,,,,,,,
out,18.0,,,,Indian Madder Root,,,,polyu_chinese_2020,,,,,,,,1.0,1,,,,,,medicine,,,,,,,,,,,,,,,,,,,,,,,,,,,,,,,,,,,,,,,,,,,茜草,qiàncǎo,,,,,,,,,,,,,,Rubiae Radix et Rhizoma,1.0,polyu-tcm,,茜草,qiàncǎo,Indian Madder Root,Dried root and rhizome of Rubia cordifolia L. (Fam. Rubiaceae),Stasis-resolving hemostatic medicinal,bitter; cold,Liver,,,,,,,,,,,,,,,
out,18.0,,,,Indian Trumpetflower Seed,,,,polyu_chinese_2020,,,,,,,,1.0,1,,,,,,medicine,,,,,,,,,,,,,,,,,,,,,,,,,,,,,,,,,,,,,,,,,,,木蝴蝶,mùhúdié,,,,,,,,,,,,,,Oroxyli Semen,1.0,polyu-tcm,,木蝴蝶,mùhúdié,Indian Trumpetflower Seed,Dried ripe fruit of Oroxylum indicum (L.) Vent. (Fam. Bignoniaceae),Heat-clearing and detoxicating medicinal,"bitter, sweet; cool","Lung, Liver, Stomach",,,,,,,,,,,,,,,
out,18.0,,,,Inula Flower,,,,polyu_chinese_2020,,,,,,,,1.0,1,,,,,,medicine,,,,,,,,,,,,,,,,,,,,,,,,,,,,,,,,,,,,,,,,,,,旋覆花,xuánfùhuā,,,,,,,,,,,,,,Inulae Flos,1.0,polyu-tcm,,旋覆花,xuánfùhuā,Inula Flower,Dried capitulum of Inula japonica Thunb. or Inula britannica L. (Fam. Compositae),Phlegm resolving medicinal,"bitter, pungent, salty; slightly warm","Lung, Spleen, Stomach, Large intestine",,,,,,,,,,,,,,,
